{"payloadSchema": "style-card.r1", "stage": "CANDIDATE", "generation": 1, "variant": "A2_PURE", "label": "冷峻市井（纯版）", "source": {"kind": "MARKET_ARCHETYPE", "archetypeIds": ["A2"], "sampleDigest": null}, "confirmedFromRef": null, "targets": {"avgParagraphChars": {"min": 23, "max": 30}, "shortParagraphPct": {"min": 35, "max": 50}, "dialogueParagraphPct": {"min": 35, "max": 65}, "similePer1k": {"min": 0, "max": 1}, "explainPer1k": {"min": 0, "max": 1.5}, "exclaimPer1k": {"min": 0, "max": 3}, "questionPer1k": {"min": 2, "max": 6}, "ellipsisPer1k": {"min": 2, "max": 10}}, "narration": {"person": "THIRD", "povPolicy": "STRICT", "voice": "话少，算得多"}, "openingStructure": ["地点三连", "一笔交易或对话", "主角的账本或目标", "世界的规矩", "能力出现"], "rules": ["用钱和价格标出处境", "每场至少一个地名或行话", "内心盘算用短句列选项", "暴力突然且短"], "forbidden": ["抒情式环境描写"], "examples": [{"technique": "用数字标处境", "lines": ["老周把三张票子压在秤盘下：\"这个月就这些，下月涨租。\"", "林满数了两遍，数目没变。"]}], "createdAt": "2026-10-23T00:00:00Z"}
